,招标文件名称,省市区,网址,类型,银行全称,行别,投标时间,报名时间,截止时间
0,宁夏回族自治区交通运输厅银川至昆明公路宁夏境太阳山开发区至彭阳（宁甘界）段项目政府和社会资本合作（PPP）项目社会资本招标中标候选人公示,回族自治,https://zb.zhaobiao.cn/succeed_v_28727124.html,中标,,,,,
1,亚洲开发银行贷款宁夏中部节水特色农业示范项目马鞍山特色农业示范区基础设施配套工程中标候选人公示,马鞍山,https://zb.zhaobiao.cn/succeed_v_28707374.html,中标,,,,,
2,银川市银川市银西生态防护林管护中心银行基本存款账户及零余额账户服务采购项目中标公示,银川市,https://zb.zhaobiao.cn/succeed_v_28715762.html,中标,,,,,
3,银川市银西生态防护林管护中心银行基本存款账户及零余额账户服务采购项目中标公示,银川市,https://zb.zhaobiao.cn/succeed_v_28716126.html,中标,,,,,
4,银川至昆明公路（G85）宁夏境太阳山开发区至彭阳（宁甘界）段政府和社会资本合作（PPP）项目社会资本招标中标候选人公示,阳山,https://zb.zhaobiao.cn/succeed_v_28718905.html,中标,,,,,
5,?巴浪湖农场蔬菜基地配套设施建设项目二标段中标公示,,https://zb.zhaobiao.cn/succeed_v_28734519.html,中标,,,,,
